{
  "$schema": "../schema/course.schema.json",
  "id": "ai",
  "title": "Artificial Intelligence Foundations",
  "version": "0.1.0",
  "status": "beta",
  "release": "launch-1",
  "summary": "A broad AI foundation spanning agents, search, knowledge representation, uncertainty, planning, machine learning, neural networks, language and perception, generative AI, evaluation and responsible risk management.",
  "audience": {
    "level": "beginner to intermediate AI learner",
    "assumed_knowledge": ["Programming Foundations", "Intermediate Python", "Basic algebra, graphs, probability and descriptive statistics or assigned remediation"],
    "target_capability": "Frame an AI problem, select and implement a modest symbolic or learned approach, evaluate it against meaningful baselines and risks, and communicate warranted limitations."
  },
  "scope": {
    "includes": ["AI literacy, problem characteristics and agents", "State-space, heuristic and adversarial search", "Symbolic, probabilistic and learned representations", "Planning and decision making", "Data, features, splits and leakage", "Supervised and unsupervised learning", "Neural-network and transformer foundations", "NLP, vision and robotics survey", "Generative AI, prompting, embeddings and retrieval augmentation", "Metrics, robustness, fairness, privacy, explainability and human oversight", "Reproducible Python experiments and capstone"],
    "non_goals": ["Training a foundation model", "Production MLOps platform engineering", "Advanced calculus-based derivations", "A vendor-specific model certification", "Autonomous deployment without human review", "NumPy or Pandas as full separate library courses"]
  },
  "authoritative_sources": [
    { "id": "cs2023-ai", "title": "CS2023 Artificial Intelligence", "url": "https://csed.acm.org/wp-content/uploads/2023/09/AI-Version-Gamma.pdf", "type": "curriculum", "version_or_date": "August 2023" },
    { "id": "cs2023-msf", "title": "CS2023 Mathematical and Statistical Foundations", "url": "https://csed.acm.org/wp-content/uploads/2023/09/MSF-Version-Gamma-V3.pdf", "type": "curriculum", "version_or_date": "August 2023" },
    { "id": "nist-ai-rmf", "title": "NIST AI Risk Management Framework", "url": "https://www.nist.gov/itl/ai-risk-management-framework", "type": "security-guidance", "version_or_date": "AI RMF 1.0; revision status monitored" },
    { "id": "nist-genai", "title": "NIST AI 600-1 Generative AI Profile", "url": "https://nvlpubs.nist.gov/nistpubs/ai/NIST.AI.600-1.pdf", "type": "security-guidance", "version_or_date": "July 2024" },
    { "id": "sklearn", "title": "scikit-learn User Guide", "url": "https://scikit-learn.org/stable/user_guide.html", "type": "official-docs", "version_or_date": "1.9.x target, accessed 2026-07" },
    { "id": "transformers", "title": "Transformers Documentation", "url": "https://huggingface.co/docs/transformers/index", "type": "official-docs", "version_or_date": "5.x target, accessed 2026-07" },
    { "id": "rag-paper", "title": "Retrieval-Augmented Generation for Knowledge-Intensive NLP Tasks", "url": "https://arxiv.org/abs/2005.11401", "type": "research", "version_or_date": "2020" }
  ],
  "runtime": {
    "kind": "multi-language",
    "language": "Python for experiments; language-neutral mathematics and pseudocode for concepts",
    "standard": "Python 3.14 with pinned scikit-learn 1.9.x and reviewed model/API fixtures",
    "toolchain": ["CPython 3.14", "scikit-learn 1.9.x", "Matplotlib-compatible supplied visualizer", "Local toy-model fixtures", "Mocked generative-model API"],
    "execution_environment": "Isolated notebooks or scripts with pinned datasets, seeded randomness, bounded compute and no autonomous external actions",
    "file_extensions": [".py", ".json", ".csv"],
    "notes": ["Course examples use small reviewed datasets and models, not live uncontrolled outputs.", "Vendor API demonstrations are mocked by default and never expose learner keys.", "Rapidly changing model-specific content requires source and version review before publication."]
  },
  "modules": [
    {
      "id": "ai.foundations",
      "title": "AI problems and agents",
      "description": "Define AI operationally and characterize environments, agents and limitations.",
      "required": true,
      "prerequisites": ["pf.problem.io", "python.quality.project"],
      "skills": [
        { "id": "ai.foundations.scope", "title": "AI, automation and intelligence claims", "description": "Distinguish AI techniques from fixed automation and evaluate claims by capability and evidence rather than marketing.", "outcomes": ["Classify example systems and state what evidence would support an intelligence claim."], "prerequisites": ["pf.problem.io"], "evidence_types": ["concept-check", "explain", "review"], "status": "required", "coverage_status": "covered", "source_refs": ["cs2023-ai", "nist-ai-rmf"] },
        { "id": "ai.foundations.problem-characteristics", "title": "Problem and environment characteristics", "description": "Classify observability, determinism, dynamics, discreteness, agents and uncertainty.", "outcomes": ["Characterize an AI task and explain how its properties constrain solution choices."], "prerequisites": ["ai.foundations.scope"], "evidence_types": ["design", "explain", "transfer"], "status": "required", "coverage_status": "covered", "source_refs": ["cs2023-ai"] },
        { "id": "ai.foundations.agents", "title": "Agent, goal and utility models", "description": "Relate perception, state, actions, goals, utility and rationality under bounded information.", "outcomes": ["Specify a simple agent's percepts, actions, objective and performance measure."], "prerequisites": ["ai.foundations.problem-characteristics"], "evidence_types": ["design", "visual", "explain"], "status": "required", "coverage_status": "covered", "source_refs": ["cs2023-ai"] },
        { "id": "ai.foundations.history-limits", "title": "History, cycles and limits", "description": "Recognize symbolic, statistical and neural traditions and recurring gaps between benchmark and general capability.", "outcomes": ["Place major approach families in context and identify an overgeneralized historical claim."], "prerequisites": ["ai.foundations.scope"], "evidence_types": ["explain", "review", "transfer"], "status": "required", "coverage_status": "covered", "source_refs": ["cs2023-ai"] }
      ]
    },
    {
      "id": "ai.search",
      "title": "State-space and adversarial search",
      "description": "Represent problems as state spaces and compare informed and uninformed exploration.",
      "required": true,
      "prerequisites": ["ai.foundations.agents", "dsa.graphs.bfs-dfs"],
      "skills": [
        { "id": "ai.search.state-space", "title": "States, actions, goals and costs", "description": "Encode a problem as an implicit graph with successors, goal test and path cost.", "outcomes": ["Design a state-space representation for a puzzle or grid task."], "prerequisites": ["ai.foundations.problem-characteristics", "dsa.graphs.model"], "evidence_types": ["design", "visual", "explain"], "status": "required", "coverage_status": "covered", "source_refs": ["cs2023-ai"] },
        { "id": "ai.search.uninformed", "title": "Uninformed search", "description": "Compare DFS, BFS, iterative deepening and uniform-cost search by completeness, optimality, time and space.", "outcomes": ["Select, implement and instrument an uninformed search for a stated state space."], "prerequisites": ["ai.search.state-space", "dsa.graphs.bfs-dfs", "dsa.heaps.priority-queue"], "evidence_types": ["code", "trace", "performance", "explain"], "status": "required", "coverage_status": "covered", "source_refs": ["cs2023-ai"] },
        { "id": "ai.search.heuristics", "title": "Heuristics, greedy search and A*", "description": "Design heuristic estimates and relate admissibility or consistency to optimality guarantees.", "outcomes": ["Implement A* and compare path cost and nodes expanded under two heuristics."], "prerequisites": ["ai.search.uninformed", "dsa.graphs.shortest-path"], "evidence_types": ["code", "design", "performance", "explain"], "status": "required", "coverage_status": "covered", "source_refs": ["cs2023-ai"] },
        { "id": "ai.search.adversarial", "title": "Minimax and alpha-beta", "description": "Back up utility through alternating choices and prune branches that cannot affect the decision.", "outcomes": ["Trace and implement bounded minimax with alpha-beta pruning for a small game."], "prerequisites": ["ai.search.state-space", "dsa.recursion.design"], "evidence_types": ["code", "trace", "visual"], "status": "required", "coverage_status": "covered", "source_refs": ["cs2023-ai"] }
      ]
    },
    {
      "id": "ai.knowledge-uncertainty",
      "title": "Knowledge representation and uncertainty",
      "description": "Encode facts and uncertain relationships and reason within explicit assumptions.",
      "required": true,
      "prerequisites": ["ai.foundations", "ai.foundations.problem-characteristics"],
      "skills": [
        { "id": "ai.knowledge.symbolic", "title": "Symbols, predicates and rules", "description": "Translate a bounded natural-language domain into facts, relations, rules and queries.", "outcomes": ["Create and evaluate a small symbolic knowledge base while stating closed- or open-world assumptions."], "prerequisites": ["ai.foundations.problem-characteristics", "pf.data.records"], "evidence_types": ["design", "trace", "explain"], "status": "required", "coverage_status": "covered", "source_refs": ["cs2023-ai", "cs2023-msf"] },